{
  "schema": "raman-studio/band-library@1",
  "id": "graphene-go",
  "name": "Graphene & graphene oxide — nine-band model",
  "material": "Graphene / graphene oxide (GO, rGO)",
  "source": {
    "title": "Raman Spectroscopy of Graphene &amp; Graphene Oxide",
    "url": "https://vascoesquivel.github.io/raman-graphene-atlas/",
    "repo": "https://github.com/VascoEsquivel/raman-graphene-atlas",
    "commit": "459f1a3cac0724c84b7c54c27c14e601c28187fa",
    "file": "index.html",
    "extractedWith": "tools/extract_atlas.py",
    "note": "Atlas fields are verbatim copies of the PEAKS, RATIOS, CHEAT and REFS constants. Blocks named match / fit / matchDefaults / fitDefaults / referenceExcitation / ratioMap are app data derived from or added to the atlas, and say so."
  },
  "referenceExcitation": {
    "nm": 532,
    "status": "assumed",
    "note": "The atlas does not state an excitation wavelength for its positions. 532 nm was chosen by the atlas author (2026-10-02) as the reference for dispersion-shifting match windows. App setting, not atlas data."
  },
  "matchDefaults": {
    "toleranceCm": 25,
    "unknownDispersionAllowanceCmPerEV": 50,
    "note": "App settings, not atlas data. A peak matches a band if it lies within the band's atlas range ± toleranceCm (after dispersion shift). Bands with dispersion.widenWindow get an extra ± allowance × |ΔE| because the atlas gives no rate for them; 50 cm⁻¹/eV is the atlas D-band rate, used as a generous envelope."
  },
  "fitDefaults": {
    "fwhmMin": 6,
    "fwhmMax": 300,
    "gaussianPercentSeed": 50,
    "windowPadCm": 100,
    "note": "App settings, not atlas data: bounds for the deconvolution fitter. Centres are bounded to each band's match window so bands cannot swap places.",
    "modelSelection": {
      "criterion": "BIC",
      "optional": [
        "Dstar",
        "Dpp",
        "Dp"
      ],
      "closeCall": 2,
      "note": "App setting, not atlas data, chosen by the atlas author (2026-10-27). In each fit window, bands listed here are kept only in the band set with the lowest Bayesian information criterion, n·ln(χ²/n) + k·ln n over the same data (Schwarz 1978, Ann. Statist. 6, 461–464); every other band is always fitted. A runner-up set within closeCall BIC units is reported with its ratios (ΔBIC < 2: 'not worth more than a bare mention', Kass & Raftery 1995, J. Am. Stat. Assoc. 90, 773–795)."
    }
  },
  "atlasNotes": {
    "title": "Raman Spectroscopy of Graphene &amp; Graphene Oxide",
    "subtitle": "An interactive atlas of the nine-band deconvolution model. Click any peak in the spectrum or a tab below to explore its vibrational origin, the physics it encodes, and how to use it diagnostically — cross-checked against the primary literature.",
    "banner": "This atlas uses the graphene-oxide 9-band deconvolution. The second-order <b>G* (D+D″)</b> band is placed at its correct <b>~2450 cm⁻¹</b> position (matching your measured data); the ~2850–2920 cm⁻¹ region is sp³ C–H stretching, not a lattice phonon band. Corrected / updated items carry a red note and references.",
    "referencesNote": "Citation counts (badges) are from <b>Semantic Scholar</b>, retrieved Jul 2026 — Google Scholar figures are typically higher. Every source is well cited; the foundational reviews exceed several thousand citations, confirming reputability. Green badges mark ≥2,000 citations.",
    "footer": "Built for reference use. Peak positions are representative and shift with excitation wavelength, strain, doping, layer number and oxidation degree — always calibrate against a known standard.<br>\n    Sources are hyperlinked above; <span style=\"color:var(--warn)\">■</span> marks references added during the accuracy review."
  },
  "bands": [
    {
      "id": "Dstar",
      "label": "D*",
      "name": "D* band (Sadezky D4)",
      "region": "first",
      "order": "First-order",
      "activated": "Disorder / sp³",
      "sym": "—",
      "posText": "~1150–1200 cm⁻¹",
      "posSort": 1180,
      "plot": {
        "mu": 1180,
        "A": 0.13,
        "sig": 42
      },
      "origin": "sp³ / C–H bending / polyene-like chains",
      "use": "sp³ functionalisation &amp; C–H/C–O edge groups",
      "process": "Not a graphene double-resonance mode. Attributed to the disordered sp³-rich phase and the phonon density of states of finite/defective domains.",
      "mechanism": "C–H in-plane bending, vibrations of short aliphatic / polyene-like (trans-polyacetylene-type) chains, and sp³-rich carbon adjacent to oxygen functional groups. In Sadezky's five-band scheme for disordered carbon this is the <b>D4</b> component.",
      "meaning": "A direct marker of <b>sp³ functionalisation</b> and edge C–H / C–O bonding. Grows with oxidation and shrinks during chemical/thermal reduction as the sp² network is restored. Frequently too weak to fit reliably in well-ordered or lightly oxidised GO.",
      "diagnostics": "Presence/area tracks oxidation degree. Its disappearance is one signature of successful reduction toward rGO.",
      "refs": [
        "claramunt15",
        "sadezky05",
        "lopez20",
        "fr2000"
      ],
      "match": {
        "range": [
          1150,
          1200
        ],
        "rangeSource": "atlas posText: ~1150–1200 cm⁻¹",
        "center": 1180,
        "centerSource": "atlas posSort",
        "dispersion": {
          "cmPerEV": 0,
          "stated": false,
          "source": "not a double-resonance band in the atlas; treated as non-dispersive"
        }
      },
      "fit": {
        "fwhmSeed": 98.9,
        "source": "atlas plot.sig × 2.3548 — the atlas's schematic curve width, used only as a starting value for deconvolution (the atlas gives no measured FWHM)"
      }
    },
    {
      "id": "D",
      "label": "D",
      "name": "D band (disorder / defect)",
      "region": "first",
      "order": "First-order",
      "activated": "Defect-activated",
      "sym": "A₁g breathing",
      "posText": "~1350 cm⁻¹",
      "posSort": 1350,
      "plot": {
        "mu": 1350,
        "A": 0.9,
        "sig": 46
      },
      "origin": "A₁g ring-breathing (1 iTO phonon, intervalley)",
      "use": "Defect density; crystallite size Lₐ / inter-defect distance L_D",
      "process": "<b>Intervalley double resonance</b> (K↔K′): one in-plane transverse-optical (iTO) phonon near the K point plus one elastic scattering event off a defect. Strongly dispersive (~50 cm⁻¹ per eV of laser energy).",
      "mechanism": "Symmetric <b>A₁g breathing mode</b> of the six-membered aromatic rings. Because it needs a defect (or edge) to conserve momentum, it is <b>forbidden in pristine, infinite single-layer graphene</b>.",
      "meaning": "The workhorse defect probe. I<sub>D</sub>/I<sub>G</sub> quantifies defect density and crystallite size — but only once you know which regime you are in (see the ratio guide: low-defect Tuinstra–Koenig vs. high-defect amorphisation).",
      "diagnostics": "Lₐ (nm) = (560/E<sub>l</sub>⁴)·(I<sub>D</sub>/I<sub>G</sub>)⁻¹ in the low-defect regime (E<sub>l</sub> in eV; Cançado 2011). Also yields inter-defect distance L_D.",
      "refs": [
        "ferraribasko13",
        "tk70",
        "cancado11",
        "malard09",
        "claramunt15"
      ],
      "match": {
        "range": [
          1350,
          1350
        ],
        "rangeSource": "atlas posText: ~1350 cm⁻¹",
        "center": 1350,
        "centerSource": "atlas posSort",
        "dispersion": {
          "cmPerEV": 50,
          "stated": true,
          "source": "atlas D.process: \"Strongly dispersive (~50 cm⁻¹ per eV of laser energy)\""
        }
      },
      "fit": {
        "fwhmSeed": 108.32,
        "source": "atlas plot.sig × 2.3548 — the atlas's schematic curve width, used only as a starting value for deconvolution (the atlas gives no measured FWHM)"
      }
    },
    {
      "id": "Dpp",
      "label": "D″",
      "name": "D″ band (Sadezky D3)",
      "region": "first",
      "order": "First-order",
      "activated": "Disorder / amorphous",
      "sym": "—",
      "posText": "~1500–1550 cm⁻¹",
      "posSort": 1520,
      "plot": {
        "mu": 1520,
        "A": 0.2,
        "sig": 52
      },
      "origin": "Amorphous sp² phase / oxygen linkages",
      "use": "Amorphous-carbon fraction &amp; functionalisation",
      "process": "Broad feature between D and G, fit as the <b>D3</b> component of disordered carbon.",
      "mechanism": "Amorphous sp² carbon and interstitial lattice defects, plus out-of-plane vibrations of oxygen functional groups (epoxy C–O–C, hydroxyl C–OH). Reflects lattice distortion by oxygen intercalants.",
      "meaning": "Its intensity/width scales with the <b>amorphous fraction</b>; it decreases and narrows during thermal annealing as the lattice recrystallises.",
      "diagnostics": "Useful for staging oxidation/reduction. Often small (undetectable) in well-crystalline flakes.",
      "correction": "The label <b>D″ is overloaded</b>. Here it denotes the ~1500 cm⁻¹ amorphous band (Sadezky D3). In mainstream graphene physics, <b>D″ instead denotes a ~1100 cm⁻¹ phonon on the LA branch</b> — the one that produces the ~2450 cm⁻¹ combination band (see the D+D″ tab). Keep the two meanings distinct when comparing papers.",
      "refs": [
        "claramunt15",
        "sadezky05",
        "lopez20",
        "malard09"
      ],
      "match": {
        "range": [
          1500,
          1550
        ],
        "rangeSource": "atlas posText: ~1500–1550 cm⁻¹",
        "center": 1520,
        "centerSource": "atlas posSort",
        "dispersion": {
          "cmPerEV": 0,
          "stated": false,
          "source": "not a double-resonance band in the atlas; treated as non-dispersive"
        }
      },
      "fit": {
        "fwhmSeed": 122.45,